URL,Version,Status,OIDs,Name,Title,Descriptino,Uses,Used,Sources
http://hl7.no/fhir/vkpobservation/ValueSet/NoDomainVitalSignsBloodPressureMeasurementMethodValueSet,0.3.6,draft,,NoDomainVitalSignsBloodPressureMeasurementMethodValueSet,NoDomainVitalSignsBloodPressureMeasurementMethod-ValueSet,"Codes representing measurement method for HeartRate",,"SCT"
http://hl7.no/fhir/vkpobservation/ValueSet/NoDomainVitalSignsBloodpressureBodySiteValueSet,0.3.6,draft,,NoDomainVitalSignsBloodpressureBodySiteValueSet,NoDomainVitalSignsBloodpressureBodySite-ValueSet,"Codes representing body site for blood pressure",,"SCT"
http://hl7.no/fhir/vkpobservation/ValueSet/vkp-performer-identifiers.valueset,0.3.6,draft,,VkpPerformerIdentifiersValueSet,VKP Performer Identifier systems ValueSet,"Identifier Systems allowed for performer identification systems in Vkp Observations",,"Internal"
http://hl7.no/fhir/vkpobservation/ValueSet/vkp-performer-organization-identifiers.valueset,0.3.6,draft,,VkpPerformerOrganizationIdentifiersValueSet,VKP Performer Identifier for organizations ValueSet,"Identifier Systems allowed for performer identification systems in Vkp Observations for organizations",,"Internal"
http://hl7.no/fhir/vkpobservation/ValueSet/vkp-performer-reference-types.valueset,0.3.6,draft,,VkpPerformerReferenceTypesValueSet,Vkp Performer reference types Systems ValueSet,"The Valueset contains all codes allowed for Observation.performer.type for use with VKP",,"hl7.fhir.r4.core"
http://hl7.no/fhir/vkpobservation/ValueSet/vkp-subject-identifiers.valueset,0.3.6,draft,,VkpSubjectIdentifiersValueSet,VKP Subject Identifier systems ValueSet,"Identifier Systems allowed for subject identifications",,"Internal"
